<xs:schema xmlns:xs="http://www.w3.org/2001/XMLSchema">
    <xs:element name="university">
        <xs:complexType>
            <xs:sequence>
                <xs:element name="students">
                    <xs:complexType>
                        <xs:sequence>
                            <xs:element name="student" maxOccurs="unbounded">
                                <xs:complexType>
                                    <xs:sequence>
                                        <xs:element name="studentId" type="xs:int"/>
                                        <xs:element name="name" type="xs:string"/>
                                        <xs:element name="surname" type="xs:string"/>
                                        <xs:element name="dateOfBirth" type="xs:date"/>
                                        <xs:element name="phoneNumber" type="xs:string"/>
                                        <xs:element name="email" type="xs:string"/>
                                        <xs:element name="careerId" type="xs:int"/>
                                    </xs:sequence>
                                </xs:complexType>
                            </xs:element>
                        </xs:sequence>
                    </xs:complexType>
                </xs:element>
                <xs:element name="careers">
                    <xs:complexType>
                        <xs:sequence>
                            <xs:element name="career" maxOccurs="unbounded">
                                <xs:complexType>
                                    <xs:sequence>
                                        <xs:element name="careerId" type="xs:int"/>
                                        <xs:element name="name" type="xs:string"/>
                                        <xs:element name="level" type="xs:string"/>
                                        <xs:element name="departmentId" type="xs:int"/>
                                    </xs:sequence>
                                </xs:complexType>
                            </xs:element>
                        </xs:sequence>
                    </xs:complexType>
                </xs:element>
                <xs:element name="departments">
                    <xs:complexType>
                        <xs:sequence>
                            <xs:element name="department" maxOccurs="unbounded">
                                <xs:complexType>
                                    <xs:sequence>
                                        <xs:element name="departmentId" type="xs:int"/>
                                        <xs:element name="name" type="xs:string"/>
                                        <xs:element name="officeId" type="xs:int"/>
                                    </xs:sequence>
                                </xs:complexType>
                            </xs:element>
                        </xs:sequence>
                    </xs:complexType>
                </xs:element>
                <xs:element name="professors">
                    <xs:complexType>
                        <xs:sequence>
                            <xs:element name="professor" maxOccurs="unbounded">
                                <xs:complexType>
                                    <xs:sequence>
                                        <xs:element name="professorId" type="xs:int"/>
                                        <xs:element name="name" type="xs:string"/>
                                        <xs:element name="surname" type="xs:string"/>
                                        <xs:element name="email" type="xs:string"/>
                                        <xs:element name="departmentId" type="xs:int"/>
                                    </xs:sequence>
                                </xs:complexType>
                            </xs:element>
                        </xs:sequence>
                    </xs:complexType>
                </xs:element>
                <xs:element name="offices">
                    <xs:complexType>
                        <xs:sequence>
                            <xs:element name="office" maxOccurs="unbounded">
                                <xs:complexType>
                                    <xs:sequence>
                                        <xs:element name="officeId" type="xs:int"/>
                                        <xs:element name="building" type="xs:string"/>
                                        <xs:element name="room" type="xs:string"/>
                                    </xs:sequence>
                                </xs:complexType>
                            </xs:element>
                        </xs:sequence>
                    </xs:complexType>
                </xs:element>
            </xs:sequence>
        </xs:complexType>
    </xs:element>
</xs:schema>
